{
  "case_id": "COIN-FY24",
  "model_id": "QuantFactory/Llama-3-8B-Instruct-Finance-RAG-GGUF:Q4_K_M",
  "prompt_version": "PV013",
  "risks": [
    {
      "risk_id": "R1",
      "risk_summary": "Decline in demand for crypto assets",
      "risk_type": "Strategic / Market / Technology",
      "evidence_quote": "In the event that the price of crypto assets or the demand for trading crypto assets decline, our business, operating results, and financial condition would be adversely affected and the price of our Class A common stock could decline.",
      "source_paragraph_ids": [
        "COIN-FY24-P002"
      ],
      "source_pages": [
        25
      ],
      "reasoning": "The selected filing sentence explicitly states the risk and a consequence.",
      "financial_impact": "Not separately analyzed in the core extraction task.",
      "time_horizon": "Not separately analyzed in the core extraction task.",
      "monitoring_indicators": [],
      "mitigation": "Not separately analyzed in the core extraction task.",
      "uncertainty": "Not separately analyzed in the core extraction task."
    },
    {
      "risk_id": "R2",
      "risk_summary": "Failure to establish or maintain strategic relationships",
      "risk_type": "Operational / Supply Chain",
      "evidence_quote": "If we are unsuccessful in establishing or maintaining strategic relationships with these third parties or if these third parties fail to deliver certain operational services, our business, operating results, and financial condition could be adversely affected.",
      "source_paragraph_ids": [
        "COIN-FY24-P008"
      ],
      "source_pages": [
        26
      ],
      "reasoning": "The selected filing sentence explicitly states the risk and a consequence.",
      "financial_impact": "Not separately analyzed in the core extraction task.",
      "time_horizon": "Not separately analyzed in the core extraction task.",
      "monitoring_indicators": [],
      "mitigation": "Not separately analyzed in the core extraction task.",
      "uncertainty": "Not separately analyzed in the core extraction task."
    },
    {
      "risk_id": "R3",
      "risk_summary": "Cybersecurity breaches or attacks",
      "risk_type": "Cybersecurity / Data / Privacy",
      "evidence_quote": "Cyberattacks and security breaches of our platform, or those impacting our customers or third parties, could adversely affect our brand, reputation, business, operating results, and financial condition.",
      "source_paragraph_ids": [
        "COIN-FY24-P012"
      ],
      "source_pages": [
        28
      ],
      "reasoning": "The selected filing sentence explicitly states the risk and a consequence.",
      "financial_impact": "Not separately analyzed in the core extraction task.",
      "time_horizon": "Not separately analyzed in the core extraction task.",
      "monitoring_indicators": [],
      "mitigation": "Not separately analyzed in the core extraction task.",
      "uncertainty": "Not separately analyzed in the core extraction task."
    }
  ]
}
