{
  "case_id": "COIN-FY24",
  "model_id": "deepseek-v4-flash-vision-exp",
  "prompt_version": "PV005",
  "risks": [
    {
      "risk_id": "R1",
      "risk_summary": "Concentration of net revenue in Bitcoin and Ethereum transactions and USDC stablecoin revenue exposes the company to significant declines if these markets deteriorate.",
      "risk_type": "Strategic / Market / Technology",
      "evidence_quote": "our net revenue is concentrated in a limited number of areas, such as transactions in Bitcoin and Ethereum",
      "reasoning": "The filing explicitly states that net revenue is concentrated in Bitcoin and Ethereum transactions and USDC stablecoin revenue, and that a decline in these areas could adversely affect business, operating results, and financial condition. This is a material risk due to the direct dependence on a few crypto assets.",
      "financial_impact": "Adverse effects on business, operating results, and financial condition; potential decline in stock price.",
      "time_horizon": "Ongoing; near-term to medium-term as market conditions evolve.",
      "mitigation": "Not disclosed in the supplied excerpt.",
      "uncertainty": "The exact magnitude of impact is not quantified; depends on market conditions and demand for these assets.",
      "source_paragraph_ids": [
        "COIN-FY24-P003",
        "COIN-FY24-P004"
      ],
      "source_pages": [
        25
      ],
      "monitoring_indicators": [
        "Trading volume of Bitcoin and Ethereum",
        "Market prices of Bitcoin and Ethereum",
        "USDC market capitalization",
        "Stablecoin revenue trends"
      ]
    },
    {
      "risk_id": "R2",
      "risk_summary": "Cyberattacks and security breaches could harm reputation, lead to theft of assets, and cause significant financial and regulatory exposure.",
      "risk_type": "Cybersecurity / Data / Privacy",
      "evidence_quote": "Cyberattacks and security breaches of our platform, or those impacting our customers or third parties, could adversely affect our brand, reputation, business, operating results, and financial condition.",
      "reasoning": "The filing highlights the risk of cyberattacks and security breaches, noting potential consequences including theft of assets, regulatory scrutiny, and reputational damage. The company has experienced past breaches, indicating this risk is material.",
      "financial_impact": "Potential theft of customer assets, remediation costs, regulatory fines, compensation payments, and loss of customer confidence.",
      "time_horizon": "Ongoing; risk increases with sophistication of attacks.",
      "mitigation": "The company has developed systems and processes to protect data, but no assurance of absolute security. Insurance may be insufficient.",
      "uncertainty": "The likelihood and severity of future breaches are uncertain; past incidents may not predict future ones.",
      "source_paragraph_ids": [
        "COIN-FY24-P012",
        "COIN-FY24-P013",
        "COIN-FY24-P014",
        "COIN-FY24-P015",
        "COIN-FY24-P019",
        "COIN-FY24-P020"
      ],
      "source_pages": [
        28,
        29
      ],
      "monitoring_indicators": [
        "Number of security incidents",
        "Customer complaints regarding security",
        "Regulatory investigations or fines",
        "Insurance claims"
      ]
    },
    {
      "risk_id": "R3",
      "risk_summary": "Reliance on third-party service providers, including banking partners and insurance carriers, creates operational risks that could disrupt services and harm the business.",
      "risk_type": "Operational / Supply Chain",
      "evidence_quote": "Loss of a critical banking or insurance relationship could adversely affect our business, operating results, and financial condition.",
      "reasoning": "The filing explicitly identifies the risk of losing critical banking or insurance relationships, which could disrupt operations and lead to regulatory risks. The company relies on third parties for essential services, and their failure could have material adverse effects.",
      "financial_impact": "Business disruptions, loss of customer funds, regulatory penalties, and increased costs.",
      "time_horizon": "Ongoing; potential for sudden disruptions.",
      "mitigation": "The company maintains redundancies in financial institutions, but no assurance of continuity.",
      "uncertainty": "The likelihood of losing a critical relationship is uncertain; depends on external factors such as banking stability and regulatory changes.",
      "source_paragraph_ids": [
        "COIN-FY24-P022",
        "COIN-FY24-P023",
        "COIN-FY24-P024",
        "COIN-FY24-P026"
      ],
      "source_pages": [
        42,
        43
      ],
      "monitoring_indicators": [
        "Changes in banking partner relationships",
        "Insurance policy renewals or cancellations",
        "Regulatory actions affecting banking partners"
      ]
    }
  ]
}
