{
  "case_id": "PYPL-FY24",
  "model_id": "QuantFactory/Llama-3-8B-Instruct-Finance-RAG-GGUF:Q4_K_M",
  "prompt_version": "PV011",
  "risks": [
    {
      "risk_id": "R1",
      "risk_summary": "Regulatory and compliance risks",
      "risk_type": "Regulatory / Legal / Geopolitical",
      "evidence_quote": "If we or the PYUSD Issuer fail to comply with regulations, requirements, prohibitions or other obligations applicable to us, we could face regulatory or other enforcement actions, potential fines, penalties, and other consequences.",
      "source_paragraph_ids": [
        "PYPL-FY24-P002"
      ],
      "source_pages": [
        18
      ],
      "reasoning": "The selected filing sentence explicitly states the risk and a consequence.",
      "financial_impact": "Not separately analyzed in the core extraction task.",
      "time_horizon": "Not separately analyzed in the core extraction task.",
      "monitoring_indicators": [],
      "mitigation": "Not separately analyzed in the core extraction task.",
      "uncertainty": "Not separately analyzed in the core extraction task."
    },
    {
      "risk_id": "R2",
      "risk_summary": "Cybersecurity and data privacy risks",
      "risk_type": "Cybersecurity / Data / Privacy",
      "evidence_quote": "If we are unable to prevent third parties from infringing or otherwise violating our proprietary rights, the uniqueness and value of our products and services could be adversely affected, the value of our brands could be diminished, and our business could be adversely affected.",
      "source_paragraph_ids": [
        "PYPL-FY24-P009"
      ],
      "source_pages": [
        21
      ],
      "reasoning": "The selected filing sentence explicitly states the risk and a consequence.",
      "financial_impact": "Not separately analyzed in the core extraction task.",
      "time_horizon": "Not separately analyzed in the core extraction task.",
      "monitoring_indicators": [],
      "mitigation": "Not separately analyzed in the core extraction task.",
      "uncertainty": "Not separately analyzed in the core extraction task."
    },
    {
      "risk_id": "R3",
      "risk_summary": "Operational and supply chain risks",
      "risk_type": "Operational / Supply Chain",
      "evidence_quote": "We expect to continue to license in the future certain of our proprietary rights, such as trademarks or copyrighted material, to others.",
      "source_paragraph_ids": [
        "PYPL-FY24-P009"
      ],
      "source_pages": [
        21
      ],
      "reasoning": "The selected filing sentence explicitly states the risk and a consequence.",
      "financial_impact": "Not separately analyzed in the core extraction task.",
      "time_horizon": "Not separately analyzed in the core extraction task.",
      "monitoring_indicators": [],
      "mitigation": "Not separately analyzed in the core extraction task.",
      "uncertainty": "Not separately analyzed in the core extraction task."
    }
  ]
}
