{
  "case_id": "PYPL-FY24",
  "model_id": "deepseek-v4-flash-vision-exp",
  "prompt_version": "PV005",
  "risks": [
    {
      "risk_id": "R1",
      "risk_summary": "Regulatory uncertainty surrounding stablecoins, particularly PayPal USD (PYUSD), could result in substantial compliance costs, enforcement actions, fines, penalties, and reputational harm.",
      "risk_type": "Regulatory / Legal / Geopolitical",
      "evidence_quote": "we and the PYUSD Issuer may face substantial costs to operationalize and comply with any additional or changed requirement.",
      "reasoning": "The filing explicitly states that the regulatory treatment of stablecoins is evolving and that there are uncertainties on how changes to laws would apply. It notes potential costs to operationalize and comply, and if they fail to comply, they could face enforcement actions, fines, penalties, and reputational harm. This is a distinct risk from other regulatory risks because it specifically addresses stablecoin regulation.",
      "financial_impact": "Substantial costs to operationalize and comply with additional or changed requirements; potential fines, penalties, and other consequences.",
      "time_horizon": "Ongoing and evolving; near-term as regulations develop.",
      "mitigation": "Not disclosed in the supplied excerpt.",
      "uncertainty": "The exact regulatory changes and their application are uncertain; the filing states 'uncertainties on how ongoing changes... would apply to stablecoins in practice.'",
      "source_paragraph_ids": [
        "PYPL-FY24-P002"
      ],
      "source_pages": [
        18
      ],
      "monitoring_indicators": [
        "Changes in federal, state, or international laws and regulations regarding stablecoins",
        "Regulatory inquiries or investigations from the SEC or other regulators"
      ]
    },
    {
      "risk_id": "R2",
      "risk_summary": "Dependence on third-party custodians for customer cryptocurrency assets exposes the company to risks of theft, loss, or bankruptcy, which could result in customer losses and harm to the business.",
      "risk_type": "Operational / Supply Chain",
      "evidence_quote": "could expose our customers and us to loss, and significantly harm our business, financial condition, and reputation.",
      "reasoning": "The filing identifies risks related to third-party custodians holding customer cryptocurrency assets, including inappropriate access, theft, destruction, insufficient insurance, custodian failure, and bankruptcy. It explicitly states that these could expose customers and the company to loss and significantly harm the business. This is a distinct operational risk because it focuses on third-party custody.",
      "financial_impact": "Loss of customer assets, customer claims, reduced consumer confidence, and material impact on cryptocurrency product offerings and operating results.",
      "time_horizon": "Ongoing; potential immediate impact if a custodian fails.",
      "mitigation": "The filing mentions contractual requirements for custodians to segregate assets, but notes uncertainty about effectiveness in bankruptcy.",
      "uncertainty": "The treatment of custodial holdings in bankruptcy is not definitively determined; the filing states 'bankruptcy courts have not yet definitively determined the appropriate treatment.'",
      "source_paragraph_ids": [
        "PYPL-FY24-P003",
        "PYPL-FY24-P004",
        "PYPL-FY24-P005"
      ],
      "source_pages": [
        18
      ],
      "monitoring_indicators": [
        "Custodian operational disruptions",
        "Custodian bankruptcy or insolvency proceedings",
        "Custodian failure to maintain effective controls"
      ]
    },
    {
      "risk_id": "R3",
      "risk_summary": "Intense competition in the global payments industry could negatively impact results of operations and financial condition if the company cannot differentiate its products and services.",
      "risk_type": "Strategic / Market / Technology",
      "evidence_quote": "we may not be able to compete effectively, which could negatively impact our results of operations and financial condition.",
      "reasoning": "The filing describes the global payments industry as highly competitive, dynamic, and innovative, with many competitors that may be larger or more agile. It states that if the company cannot differentiate its products and services, drive value, or align resources, it may not compete effectively, which could negatively impact results and financial condition. This is a distinct strategic risk.",
      "financial_impact": "Negative impact on results of operations and financial condition.",
      "time_horizon": "Ongoing; competitive pressures are continuous.",
      "mitigation": "Not disclosed in the supplied excerpt.",
      "uncertainty": "The filing does not quantify the likelihood or magnitude of competitive impact; it states 'could negatively impact.'",
      "source_paragraph_ids": [
        "PYPL-FY24-P011",
        "PYPL-FY24-P012",
        "PYPL-FY24-P013"
      ],
      "source_pages": [
        21
      ],
      "monitoring_indicators": [
        "New competitors entering the market",
        "Changes in customer preferences and price sensitivity",
        "Competitors offering lower prices or innovative products"
      ]
    }
  ]
}
