{
  "case_id": "COIN-FY24",
  "model_id": "gemma4:26b-a4b-it-q4_K_M",
  "prompt_version": "PV006",
  "risks": [
    {
      "risk_id": "R1",
      "risk_summary": "Volatility or decline in the price and demand for supported crypto assets could adversely affect financial condition and stock price.",
      "risk_type": "Strategic / Market / Technology",
      "evidence_quote": "price of crypto assets or the demand for trading crypto assets decline",
      "source_paragraph_ids": [
        "COIN-FY24-P002"
      ],
      "source_pages": [
        25
      ],
      "reasoning": "The decline in price or demand is stated to adversely affect business, operating results, and financial condition.",
      "financial_impact": "adversely affected and the price of our Class A common stock could decline",
      "time_horizon": "Not disclosed in the supplied excerpt.",
      "monitoring_indicators": [],
      "mitigation": "Not disclosed in the supplied excerpt.",
      "uncertainty": "There is no assurance that any supported crypto asset will maintain its value"
    },
    {
      "risk_id": "R2",
      "risk_summary": "Cyberattacks and security breaches of the platform or third parties could damage brand, reputation, and financial condition.",
      "risk_type": "Cybersecurity / Data / Privacy",
      "evidence_quote": "Cyberattacks and security breaches of our platform, or those impacting our customers",
      "source_paragraph_ids": [
        "COIN-FY24-P012"
      ],
      "source_pages": [
        28
      ],
      "reasoning": "Breaches are stated to adversely affect brand, reputation, business, operating results, and financial condition.",
      "financial_impact": "could adversely affect our brand, reputation, business, operating results, and financial condition",
      "time_horizon": "Not disclosed in the supplied excerpt.",
      "monitoring_indicators": [],
      "mitigation": "Not disclosed in the supplied excerpt.",
      "uncertainty": "Not disclosed in the supplied excerpt."
    },
    {
      "risk_id": "R3",
      "risk_summary": "Failure of third-party service providers or loss of critical banking relationships could lead to business disruptions and financial losses.",
      "risk_type": "Operational / Supply Chain",
      "evidence_quote": "If any third parties do not adequately or appropriately provide their services",
      "source_paragraph_ids": [
        "COIN-FY24-P021"
      ],
      "source_pages": [
        42
      ],
      "reasoning": "Inadequate third-party services may result in business disruptions, losses, or costs to remediate deficiencies.",
      "financial_impact": "we may be subject to business disruptions, losses or costs to remediate",
      "time_horizon": "Not disclosed in the supplied excerpt.",
      "monitoring_indicators": [],
      "mitigation": "Not disclosed in the supplied excerpt.",
      "uncertainty": "There can be no assurance that third parties... will continue to do so"
    }
  ]
}
