{
  "case_id": "PYPL-FY24",
  "model_id": "QuantFactory/Llama-3-8B-Instruct-Finance-RAG-GGUF:Q4_K_M",
  "prompt_version": "PV010",
  "risks": [
    {
      "risk_id": "R1",
      "risk_summary": "Strategic / Market / Technology",
      "risk_type": "Strategic / Market / Technology",
      "evidence_quote": "The networks set and interpret their rules, and have alleged from time to time that various aspects of our business model violate these rules, or our agreements with the networks.",
      "source_paragraph_ids": [
        "PYPL-FY24-P017"
      ],
      "source_pages": [
        21
      ],
      "reasoning": "The risk is due to the intense competition in the global payments industry, the rapid evolution of innovative technologies, and the potential for regulatory changes.",
      "financial_impact": "Increased costs, reduced revenue, and potential reputational harm",
      "time_horizon": "Short-term to long-term",
      "monitoring_indicators": [
        "Analytical suggestion: Monitor for changes in regulatory requirements and competitive landscape"
      ],
      "mitigation": "Not disclosed in the selected evidence sentence.",
      "uncertainty": "Uncertainty in the timing and extent of regulatory changes and competitive responses"
    },
    {
      "risk_id": "R2",
      "risk_summary": "Operational / Supply Chain",
      "risk_type": "Operational / Supply Chain",
      "evidence_quote": "We are subject to additional risks inherent in engaging and relying upon third-party providers, including operational, legal, regulatory, information security, reputational, commercial, and resiliency risks.",
      "source_paragraph_ids": [
        "PYPL-FY24-P029"
      ],
      "source_pages": [
        23
      ],
      "reasoning": "The risk is due to the reliance on third-party providers, potential disruptions in these relationships, and the potential for operational and reputational harm.",
      "financial_impact": "Increased costs, reduced revenue, and potential reputational harm",
      "time_horizon": "Short-term to long-term",
      "monitoring_indicators": [
        "Analytical suggestion: Monitor for changes in third-party provider relationships and operational disruptions"
      ],
      "mitigation": "Not disclosed in the selected evidence sentence.",
      "uncertainty": "Uncertainty in the timing and extent of operational disruptions and changes in third-party provider relationships"
    },
    {
      "risk_id": "R3",
      "risk_summary": "Regulatory / Legal / Geopolitical",
      "risk_type": "Regulatory / Legal / Geopolitical",
      "evidence_quote": "While a number of state attorneys general have unsuccessfully challenged these FDIC and OCC rules, there remains some uncertainty whether non-bank entities purchasing loan receivables originated by FDIC-insured, state-chartered banks may rely on federal preemption of state usury laws and other state laws.",
      "source_paragraph_ids": [
        "PYPL-FY24-P026"
      ],
      "source_pages": [
        23
      ],
      "reasoning": "The risk is due to the potential for regulatory changes, legal challenges, and geopolitical events that could impact the company's operations and financial performance.",
      "financial_impact": "Increased costs, reduced revenue, and potential reputational harm",
      "time_horizon": "Short-term to long-term",
      "monitoring_indicators": [
        "Analytical suggestion: Monitor for changes in regulatory requirements and geopolitical events"
      ],
      "mitigation": "Not disclosed in the selected evidence sentence.",
      "uncertainty": "Uncertainty in the timing and extent of regulatory changes and geopolitical events"
    }
  ]
}
